{
 "backtest": {
  "centre_doy": 274,
  "date_to": "2026-08-27",
  "debias_window_days": 60,
  "half_width_days": 45,
  "min_hours": 24,
  "n_cities_in_snapshot": 49,
  "note": "first build",
  "snapshot_generated_at": "2026-09-09T20:21:10+00:00"
 },
 "code_version": "export_board_inputs/2.0.0",
 "gates": [
  {
   "adopted": "2026-09-06",
   "name": "k* = 2",
   "provisional": false,
   "reason": "measured exceedance at +2 under the 8.5% break-even",
   "threshold": 2
  },
  {
   "adopted": "2026-09-09",
   "expires": "2026-10-21",
   "name": "mode share >= 35%",
   "provisional": true,
   "reason": "flat ladders make '+2' meaningless; never backtested, same n=1 origin as the ceiling",
   "threshold": 0.35
  },
  {
   "adopted": "2026-09-06",
   "name": "depth >= $600",
   "provisional": false,
   "reason": "below this the book cannot be worked",
   "threshold": 600
  },
  {
   "adopted": "2026-09-06",
   "name": "closed top bucket",
   "provisional": false,
   "reason": "an open end prices an unbounded tail as one bucket; vindicated by Karachi 2026-09-12",
   "threshold": null
  },
  {
   "adopted": "2026-09-06",
   "name": "multiple > 1.00",
   "provisional": false,
   "reason": "a price at or below the measured tail is not a trade at any rank",
   "threshold": 1.0
  },
  {
   "adopted": "2026-09-09",
   "expires": "2026-10-21",
   "name": "multiple <= 2.5x",
   "provisional": true,
   "reason": "adopted from Munich alone, n=1; lapses by default under the ratchet rule",
   "threshold": 2.5
  }
 ],
 "generated_utc": "2026-09-29T04:15:04+00:00",
 "schema": 1,
 "stations": {
  "amsterdam": {
   "debias_asof": "2026-08-27",
   "debias_basis": "open_meteo_1117_max",
   "debias_c": 0.4,
   "debias_method": "median(actual - Open-Meteo 11:00-17:00 max), seasonal window doy 274 +/- 45",
   "debias_n": 193,
   "debias_sign": "actual_minus_forecast",
   "debias_transfers": true,
   "display": "Amsterdam",
   "icao": "EHAM",
   "lat": 52.309,
   "lon": 4.764,
   "resid_ge2_share": 0.0155,
   "resid_p10": -0.4,
   "resid_p90": 1.3,
   "resid_sd": 0.77,
   "station_name": "Amsterdam Schiphol",
   "station_verified": false
  },
  "ankara": {
   "debias_asof": "2026-08-27",
   "debias_basis": "open_meteo_1117_max",
   "debias_c": 0.3,
   "debias_method": "median(actual - Open-Meteo 11:00-17:00 max), seasonal window doy 274 +/- 45",
   "debias_n": 193,
   "debias_sign": "actual_minus_forecast",
   "debias_transfers": true,
   "display": "Ankara",
   "icao": "LTAC",
   "lat": 40.128,
   "lon": 32.995,
   "resid_ge2_share": 0.0,
   "resid_p10": -0.8,
   "resid_p90": 1.1,
   "resid_sd": 0.87,
   "station_name": "Ankara Esenboga",
   "station_verified": false
  },
  "beijing": {
   "debias_asof": "2026-08-27",
   "debias_basis": "open_meteo_1117_max",
   "debias_c": 1.5,
   "debias_method": "median(actual - Open-Meteo 11:00-17:00 max), seasonal window doy 274 +/- 45",
   "debias_n": 193,
   "debias_sign": "actual_minus_forecast",
   "debias_transfers": true,
   "display": "Beijing",
   "icao": "ZBAA",
   "lat": 40.08,
   "lon": 116.585,
   "resid_ge2_share": 0.0207,
   "resid_p10": -0.3,
   "resid_p90": 2.7,
   "resid_sd": 1.47,
   "station_name": "Beijing Capital",
   "station_verified": false
  },
  "buenos-aires": {
   "debias_asof": "2026-08-27",
   "debias_basis": "open_meteo_1117_max",
   "debias_c": 1.1,
   "debias_method": "median(actual - Open-Meteo 11:00-17:00 max), seasonal window doy 274 +/- 45",
   "debias_n": 193,
   "debias_sign": "actual_minus_forecast",
   "debias_transfers": true,
   "display": "Buenos Aires",
   "icao": "SAEZ",
   "lat": -34.822,
   "lon": -58.536,
   "resid_ge2_share": 0.0207,
   "resid_p10": -0.2,
   "resid_p90": 2.3,
   "resid_sd": 1.11,
   "station_name": "Buenos Aires Ezeiza",
   "station_verified": false
  },
  "busan": {
   "debias_asof": "2026-08-27",
   "debias_basis": "open_meteo_1117_max",
   "debias_c": 0.7,
   "debias_method": "median(actual - Open-Meteo 11:00-17:00 max), seasonal window doy 274 +/- 45",
   "debias_n": 193,
   "debias_sign": "actual_minus_forecast",
   "debias_transfers": true,
   "display": "Busan",
   "icao": "RKPK",
   "lat": 35.18,
   "lon": 128.938,
   "resid_ge2_share": 0.0363,
   "resid_p10": -0.7,
   "resid_p90": 2.1,
   "resid_sd": 1.24,
   "station_name": "Busan Gimhae",
   "station_verified": false
  },
  "cape-town": {
   "debias_asof": "2026-08-27",
   "debias_basis": "open_meteo_1117_max",
   "debias_c": -0.4,
   "debias_method": "median(actual - Open-Meteo 11:00-17:00 max), seasonal window doy 274 +/- 45",
   "debias_n": 193,
   "debias_sign": "actual_minus_forecast",
   "debias_transfers": true,
   "display": "Cape Town",
   "icao": "FACT",
   "lat": -33.965,
   "lon": 18.602,
   "resid_ge2_share": 0.0259,
   "resid_p10": -2.4,
   "resid_p90": 1.1,
   "resid_sd": 1.41,
   "station_name": "Cape Town Intl",
   "station_verified": false
  },
  "chengdu": {
   "debias_asof": "2026-08-27",
   "debias_basis": "open_meteo_1117_max",
   "debias_c": 0.7,
   "debias_method": "median(actual - Open-Meteo 11:00-17:00 max), seasonal window doy 274 +/- 45",
   "debias_n": 193,
   "debias_sign": "actual_minus_forecast",
   "debias_transfers": true,
   "display": "Chengdu",
   "icao": "ZUUU",
   "lat": 30.578,
   "lon": 103.947,
   "resid_ge2_share": 0.1503,
   "resid_p10": -1.2,
   "resid_p90": 3.2,
   "resid_sd": 1.72,
   "station_name": "Chengdu Shuangliu",
   "station_verified": false
  },
  "chongqing": {
   "debias_asof": "2026-08-27",
   "debias_basis": "open_meteo_1117_max",
   "debias_c": 0.5,
   "debias_method": "median(actual - Open-Meteo 11:00-17:00 max), seasonal window doy 274 +/- 45",
   "debias_n": 193,
   "debias_sign": "actual_minus_forecast",
   "debias_transfers": true,
   "display": "Chongqing",
   "icao": "ZUCK",
   "lat": 29.719,
   "lon": 106.642,
   "resid_ge2_share": 0.0829,
   "resid_p10": -1.6,
   "resid_p90": 2.4,
   "resid_sd": 1.58,
   "station_name": "Chongqing Jiangbei",
   "station_verified": false
  },
  "guangzhou": {
   "debias_asof": "2026-08-27",
   "debias_basis": "open_meteo_1117_max",
   "debias_c": 1.9,
   "debias_method": "median(actual - Open-Meteo 11:00-17:00 max), seasonal window doy 274 +/- 45",
   "debias_n": 193,
   "debias_sign": "actual_minus_forecast",
   "debias_transfers": true,
   "display": "Guangzhou",
   "icao": "ZGGG",
   "lat": 23.392,
   "lon": 113.299,
   "resid_ge2_share": 0.0518,
   "resid_p10": -0.5,
   "resid_p90": 3.5,
   "resid_sd": 1.51,
   "station_name": "Guangzhou Baiyun",
   "station_verified": false
  },
  "helsinki": {
   "debias_asof": "2026-08-27",
   "debias_basis": "open_meteo_1117_max",
   "debias_c": 0.4,
   "debias_method": "median(actual - Open-Meteo 11:00-17:00 max), seasonal window doy 274 +/- 45",
   "debias_n": 193,
   "debias_sign": "actual_minus_forecast",
   "debias_transfers": true,
   "display": "Helsinki",
   "icao": "EFHK",
   "lat": 60.317,
   "lon": 24.963,
   "resid_ge2_share": 0.0155,
   "resid_p10": -1.0,
   "resid_p90": 1.4,
   "resid_sd": 1.02,
   "station_name": "Helsinki Vantaa",
   "station_verified": false
  },
  "istanbul": {
   "debias_asof": "2026-08-27",
   "debias_basis": "open_meteo_1117_max",
   "debias_c": -0.2,
   "debias_method": "median(actual - Open-Meteo 11:00-17:00 max), seasonal window doy 274 +/- 45",
   "debias_n": 193,
   "debias_sign": "actual_minus_forecast",
   "debias_transfers": true,
   "display": "Istanbul",
   "icao": "LTFM",
   "lat": 41.262,
   "lon": 28.742,
   "resid_ge2_share": 0.0155,
   "resid_p10": -1.2,
   "resid_p90": 0.9,
   "resid_sd": 0.86,
   "station_name": "Istanbul",
   "station_verified": false
  },
  "jeddah": {
   "debias_asof": "2026-08-27",
   "debias_basis": "open_meteo_1117_max",
   "debias_c": 0.3,
   "debias_method": "median(actual - Open-Meteo 11:00-17:00 max), seasonal window doy 274 +/- 45",
   "debias_n": 193,
   "debias_sign": "actual_minus_forecast",
   "debias_transfers": true,
   "display": "Jeddah",
   "icao": "OEJN",
   "lat": 21.68,
   "lon": 39.157,
   "resid_ge2_share": 0.0466,
   "resid_p10": -1.1,
   "resid_p90": 1.8,
   "resid_sd": 1.19,
   "station_name": "Jeddah King Abdulaziz",
   "station_verified": false
  },
  "karachi": {
   "debias_asof": "2026-08-27",
   "debias_basis": "open_meteo_1117_max",
   "debias_c": 0.1,
   "debias_method": "median(actual - Open-Meteo 11:00-17:00 max), seasonal window doy 274 +/- 45",
   "debias_n": 193,
   "debias_sign": "actual_minus_forecast",
   "debias_transfers": true,
   "display": "Karachi",
   "icao": "OPKC",
   "lat": 24.907,
   "lon": 67.161,
   "resid_ge2_share": 0.0155,
   "resid_p10": -1.1,
   "resid_p90": 1.3,
   "resid_sd": 0.97,
   "station_name": "Karachi Jinnah",
   "station_verified": false
  },
  "kuala-lumpur": {
   "debias_asof": "2026-08-27",
   "debias_basis": "open_meteo_1117_max",
   "debias_c": 0.4,
   "debias_method": "median(actual - Open-Meteo 11:00-17:00 max), seasonal window doy 274 +/- 45",
   "debias_n": 193,
   "debias_sign": "actual_minus_forecast",
   "debias_transfers": true,
   "display": "Kuala Lumpur",
   "icao": "WMKK",
   "lat": 2.746,
   "lon": 101.71,
   "resid_ge2_share": 0.1399,
   "resid_p10": -1.6,
   "resid_p90": 2.7,
   "resid_sd": 1.69,
   "station_name": "Kuala Lumpur Intl",
   "station_verified": false
  },
  "london": {
   "debias_asof": "2026-08-27",
   "debias_basis": "open_meteo_1117_max",
   "debias_c": 0.4,
   "debias_method": "median(actual - Open-Meteo 11:00-17:00 max), seasonal window doy 274 +/- 45",
   "debias_n": 193,
   "debias_sign": "actual_minus_forecast",
   "debias_transfers": true,
   "display": "London",
   "icao": "EGLC",
   "lat": 51.505,
   "lon": 0.055,
   "resid_ge2_share": 0.0104,
   "resid_p10": -0.7,
   "resid_p90": 1.4,
   "resid_sd": 0.9,
   "station_name": "London City",
   "station_verified": false
  },
  "lucknow": {
   "debias_asof": "2026-08-27",
   "debias_basis": "open_meteo_1117_max",
   "debias_c": 0.5,